2026.05.12. 17:19:28;Pince;Vasrúd;Büntetés;Őrült;Dolgozat;Ház, kémény, füst;Hadsereg, háború, halál;Alvás, párna, puha;Biokémia;Por;Némi szorongást éreznék. Valószínűleg eltévedt, és segítséget szeretne kérni, és azt hiszi, én értem, mit mond. Megpróbálnám több nyelven elmondani, hogy nem értem, hátha beszéli valamelyiket.;Itt is némi szorongást éreznék. Valószínűleg valami fontosról van szó, de nem szeretek ismeretlen számokat felvenni. Lehet, hogy valamilyen baj történt. Megpróbálnám összeszedni magam és visszahívnám.;A kép egyszerre kelt bennem szorongást, hogy mindjárt leesik az ember, és egyszerre némi szabadságérzetet. A szorongás viszont erősebb, kissé tériszonyom van.;A kép a nyárra emlékeztet, kellemes hangulatú. A nyál kicsit összefutott a számban.;Ez egy denevérre emlékeztet. Bár a tetejénél inkább olyan, mintha egy panda vagy koala lenne. Az egész kissé oroszlánra is emlékeztet.;A kép olyan, mintha kettő lény ülne egymásnak háttal, vagy mint egy kecske feje. A két szélén a pöttyök melletti részek olyanok, mintha 90°-ban elforgatott tehénfejek lennének.
2026.05.12. 21:36:20;Pince;Villa;Kudarc;Őrület;Tanulás;Ajtó, ház, felújítás;Győzelem, harc, csata;Erdő, fa, fény;Pihenés;Unalom;Azt gondolnám, hogy bajban van és segítséget próbál épp kérni. Megpróbálnám valahogy megérteni, amit mond, telefonnal, fordítással. Majd a tartalom alapján segíteni neki, ha tudok, vagy segítséget hívni neki.;Biztosan idegen hív, nem ismerős, egy ajánlattal vagy felméréssel. Sms üzenetben próbálnám kideríteni, hogy ki az, és mit akar. Ha erre válaszul ismét felhívna, felvennem, de tartózkodva.;Nem bizalomgerjesztő a kép, inkább ijesztő. Tériszonyom lenne itt, nem ülnék ki ide. A kép szereplője rossz kedvű, talán depressziós lehet, talàn meggondolatlan cselekedetet akar véghez vinni.;"Megindult a nyálelválasztásom:)
Nem harapnék bele, mert nem tesz jót a fogzománcnak, félteném a fogaimat. És az izét sem szeretem kifejezetten";Egy medencecsontra emlékeztet, egy teljes csípő izületre. Egészségügyi érzetem van tőle, mintha egy röntgen eredményét nézném az orvosnál;Egy nagy bogárra emlékeztet, ami épp egy helyben áll. 
2026.05.12. 23:59:13;Régi;Fényes;Lenézés;;Figyelem;Ajtó, lábujj, fájdalom;Csata, nehézség, győzelem;Nyugodtság, béke, család;Nap;Munka;Az első gondolatom hogy mit szeretne tőlem. Valőszínűleg külföldi eltévedt. Nem értem mit szeretne;Ijesztő, nyomulós. Lehet hogy tévesen hívogat, elítja a számot. Miért nem tud kapcsolatba lépni velem;Ez egy filmbe illő jelenet ahol a hős menekülhet. Gondolkozik hogy leugroljon enés ezzel mentse az életét.;A citrom savanyú, mégis ebből készítjük a limonádét. Azonban hirtelen harapás lehet hiszen nem számít ilyen keserű ízre;Ez egy mérges denevér akk repül. Egy nehéz időszakhoz tudnám párosítani.;Ez lehetne egy bogár, szerintem hasonlít a katicához. Egy tavaszi környezetbe képzelném el
2026.05.13. 9:36:20;Illat;Íz;Negativitás;Káosz;Figyelem;Ajtó, folyosó, bejárat;Győzelem, siker, öröm ;Nyugalom, boldogság, feltöltöttség;Bolygó;Fáradtság;Megpróbálnám neki angolul elmondani, hogy nem ismerem a nyelvet. Haszalnálnám azt az alkalmazást ami a beszédet lefordítja az ő vagy az én nyelvemre, így könnyebben értenénk egymást és így tudnék segíteni neki. Szerintem lehet eltévedhetett és biztos jól esne neki egy kis segítség.;Elsőnek annyira nem foglalkoznék vele, mert nem szeretem és nem is szoktam felvenni az ismeretlen számot. Mivel sokadszorra hív, felvenném vagy visszahívnám és megbeszélném vele az adott dolgot amiről szeretett volna beszélni velem.;Kicsit félelmetes, hogy ilyen magasban ül az épület szélén. A sötét színek borongóssá teszik a képet.;Az előző képhez képest élénkebb, jobb hangulatú. Az a citrom biztos savanyú lehetett. Mindenféleképpen a nyárra emlékeztet a kép.;A forma számomra egy szétterülő denevérre vagy pillangóra emlékeztet. A két oldal szimmetriája egyszerre nyugodt és kissé nyugtalanító hatást kelt. Olyan, mintha egy sötét erdőben vagy egy álomszerű világban lebegne. A középső rész emberalakot is idéz, mintha valaki két külön világ között állna. Az egész kép titokzatos, komor, mégis dinamikus atmoszférát sugall.;A kép egy különös, szarvakkal rendelkező lényre emlékeztet. Egyszerre játékos és nyugtalanító hangulata van, mintha egy fantasyvilágból származna.
2026.05.13. 13:20:11;pince;vas;csoport;kórház;tanulás;ajtó, ház, kert;győzelem, kupa, öröm ;nyugalom, erdő, fa;puha;düh;Értetlenség lenne bennem a helyzettel kapcsolatban, megpróbálnám jelezni arckifejezéssel és kézmozdulatokkal, hogy nem értem őt. Amennyiben tovább folytatódik, elmennék. ;Nem szoktam felvenni ismeretlen számokat, de ha ötször keresett valószínűleg visszahívnám. Viszont tartanék tőle, hogy mi történhetett. ;Ez egy nagyon ijesztő helyzet, közel van ahhoz hogy leessen. ;;Két táncoló ember leginkább arra emlékeztet.  ;Állatokat ismerek fel benne leginkább, két nagyobb bogár, illetve valamilyen rágcsáló kisebben. 
2026.05.13. 16:41:17;penész;illat;szemforgatás;hangyák;tudás;padló,szőnyeg,porszívó;bika,piros,cseresznye;természet,kikapcsolódás,jóga;Rúzs;Festék;"Ilyen helyzetekben zárkózott vagyok, nagyon kényelmetlenül érezném magam. Megpróbálnék angolul beszélni az illetőnek, hátha azt a nyelvet ismeri.
Szerintem a másik félnek is zavarbaejtő a szituáció.";Először nem érteném, mert egy adott szűk körrel telefonálok általában. Valószínűleg visszahívnám, biztosan fontosat szeretne, hiszen a hívások száma is ezt sugallja.;"Félelmetesnek gondolom ezt a képet és akár konkrét céllal vagy cél nélkül ott, nagyon zavaros.
Ehhez a nyomasztó érzéshez hozzájárulnak a brutális felhőkarcolók és az időjárás körülményei is. Fázom a képtől.";Számomra pozitív töltetű a kép, az jut eszembe róla, mikor az étteremben limonádét rendelünk. Ha elfogy az ital, a citromot mindig kiesszük belőle. :) ;Két embert látok, akik egymás tükörképe. Mindezek ellenére harcolnak egymással.;A képről egy katicabogárra gondoltam, ami alapvetően pozitív és jó emlékeket idéz fel bennem. Az alakzat színe az, ami árnyalja bennem ezt a képet.
2026.05.13. 17:37:25;Büdös;Íz;Ítélkezés;Bolondokháza;Stressz;Ajtó,szoba,lakás;Nyer,csata,büszkeség;Chill,imádom,madárcsicsergés;Cérna;Unalom;Jó lenne tudni mit akar. Valahogy el kellene tűnni. Miért pont én…;Ki a fene lehet? Nem szoktam ismeretlen számról hívást felvenni. De ez nagyon akar velem beszélni…;Soha sem akarok ilyen helyzetbe kerülni… irtózok a magasságtól.;Na ettől kikészülnék. Kivéve, ha Tequila követi.;Irtozom az ilyen sötét alakzatoktól. Ez egy ronda paca.;Mint két nyúl egymásnak háttal. Nem értem mit szeretne ábrázolni és mire jó…
2026.05.14. 9:37:48;pince;metál;utálat;őrület;tanulás;ajtó, kilincs, kulcs;győzelem, csata, ló;némaság, ridegség, gyűlölet;citromfű;autó;"1. Arra gondolok, hogy ezt a nyelvet nem beszélem.
2. Az, hogy kétségbeesett/siet az illető.
3. Megpróbálnék angolra váltani.
4. Valószínűleg csak próbál megoldást találni a problémájára.";"1. Arra gondolok, hogy biztos csak valami reklám.
2. Az, hogy korábban nem vettem fel.
3. Visszahívnám egyszer.
4. Az, hogy valószínűleg nem érdekel különösebben a dolog.";Magányos, néma elmélkedés jut eszembe a város fényeit nézve. Az illető valószínűleg menekül valami (egy helyzet, egy gondolat) elől, és ki akarja szellőztetni a fejét.;Valószínűleg egy forró, nyári napon a limonádé elfogyasztása után eszik citromot a hölgy. Arckifejezéséből ítélve boldog, talán barátokkal van éppen.;"Egy fekete pillangót látok.
Egy természeti képbe tudnám beilleszteni, mely békét és melegséget tükröz.";"Egy fekete, csápos bogarat látok.
Szintén a természetben tudnám elképzelni, egy olyat képben, mely csendet, elzártságot ábrázol."
2026.05.14. 11:37:31;Ház;Kábel;Múlt;Nyelvtan;Tanóra;Ajtó, ház, múlt;Kép, rajz, tanár;Fa, park, vidék;Mikrobiológia;Szonáta;Az első gondolatom, hogy mit szeretne. Megpróbálnék szavakat megérteni az alapján, hogy hasonlít-e egyes angol szavakra. Angolul próbálnék rákérdezni vagy mutatogtani. ;Az első gondolatom, hogy vajon ki lehetett. Megfordul a fejemben annak a valószínűsége, hogy csaló volt. Végiggondolom, hogy megadtam-e valakinek a telefonszámomat az elmúlt időszakban. ;Az első gondolatom, hogy ijesztő. Én soha nem szeretnék ilyen helyzetben lenni. Ugyanakkor szívesen elutaznék New Yorkba. A kép kicsit túl sötét az én ízlesemnek. ;Az első dolog, ami eszembe jutott a képről az a nyár. Már alig várom, hogy végre nyár legyen. Szeretem a citromot, de szörnyű érzés beleharapni. ;Ez a kép a világtérképre emlékeztet első ránézésre. Majd egy lepke jutott róla eszembe. ;Első ránézésre egy szarvasbogár jutott róla eszembe. Majd két alakzat egymásnak háttal állva. 
2026.05.14. 17:26:29;ház;cső;ítélkezés;kusza;figyelem;ajtó, szoba, otthon;siker, elismerés, dícséret;gondolat, énidő, nyugalom;rádió;szekrény;"Megpróbálnám lerázni, elküldeni. próbálnék mástól segítséget kérni, hogy az az illető hátha érti és tud segíteni. Viszont ha nem tudnám""átpasszolni"" felidegesítene. A másik fél helyébe mástól kérnék segítséget.";Ha látom hogy folyamatosan hívogat, következő alkaolmmal felvenném a telefont, de nem hívnám vissza. Ha akar valamit úgyis hívogatni fog még. ;Tériszony. A kép készítője helyébe nagyon félnék ott fent. Nem mernék úgy kiülni az épület tetejére. Rettegnék attól hogy véletlenül leesek és nem lehet vissazafordítani a helyzetet. Ha ottlennék plusz egy főként megpróbálnám vissza hívni az illetőt biztonságos helyre. ;A nyár szabadsága jut eszembe. A meleg, a napsütés a citrom frissítő hatása. Nyaralás, strandolás a nyugalom jut eszembe erről a képről. ;Szimmetrikus alagzat. Pillangó forma. Valamilyen szinten a gyerekkori kézműveskedéseket idézi bennem. Egy pillangót látok benne ahogyan elrepül a kertben. ;Ez pedig egy bodobácsra vagy szarvasbogárra hasonlít. Ez is a kert közelségét idézi bennem, gyerekoromat ahogyan az óvodai/iskolai kertekben gyűjtöttem a bodobácsokat, sétáltattam a kezemen a katicákat. Rovarra hasonlít az alakzat. 
2026.05.17. 19:16:52;Büdös;Hideg;Szégyen;Bolond;Figyelem;Fa, Természet, Nap;Csata, Küzdelem, Nyereség;Halk, Éjszaka, Sötétség;Virsli;Temetés;Biztos barátkozni szeretne vagy segítséget kérni. Megpróbálnám elmagyarázni, hogy nem értem amit mond vagy csak bólogatnék és mosolyognék, esetleg nemet intenék. Ha tudnék segítséget kérnék vagy attól függően, hogy mennyire van pánikban, lehet használnák valami fordítót. Biztos, hogy kellemetlenül érezném magam.;Mindig szorongás fogad el a telefonnal kapcsolatban, de ha valaki ennyiszer keres, akkor biztos fontos lenne. Valószínüleg visszahívnám és megtudakolnám, hogy mi a probléma. Lehetséges, hogy valakivel valami történt vagy esetleg munkával kapcsolatban keresnek.;Vagány lehet ilyen magasról nézni egy várost, viszont ijesztő is, egy rossz mozdulat és az ember leesik. Viszont biztos megvan az az érzés, hogy a világ tetején ülsz. Remélhetőleg a készítőben csak ilyesmi megmerült fel és nem öngyilkossági kísérlet.;Biztos vagyok benne, hogy nagyon savanyú lehet és nem hiszem, hogy sokáig mosolyogna. Elég boldognak látszik és úgy tűnik, hogy egy nyári nap készíthették a képet. Szerintem citromból jobb limonádét készíteni frissítőként citromba harapás helyett.;Úgy néz ki mint egy medencecsont vagy egy repülő madár vagy dinoszaurusz. Amúgy egy agyra is emlékeztet, főleg amikor azokat a képeket készítik róla, hogy melyik agyrészek villannak fel a használat alatt.;Két húsvéti nyuszi egymással háttal álnak és van a kezükben egy kiskutya ami felnéz. Ez elég vidámnak néz ki. Bár akár egy nagyon kövér bogár is lehetne vagy egy csápos ürlény,
